"pageid","pageparent","pagetitle","pagelive","pageintrash","titletag","metadesc","publishdate","oldurl","pagedata","post_type","published","fix_images","blogcategories","tags","overrideurl","noindex"
"","0","Creative Resources Technology Group, Inc.","live","0","Apple Consultants Network - Your Local Expert","The Apple Consultants Network are local, independent businesses offering IT services and solutions for your home, school or business. Learn more today","","https://consultants.apple.com/us/profile/505043","{""title"":""Creative Resources Technology Group, Inc."",""display-title"":""Creative Resources Technology Group, Inc."",""article-author"":"""",""preview-image"":{""imagefile"":"""",""alt"":""Creative Resources Technology Group, Inc.""},""hero-image"":{""imagefile"":"""",""alt"":""Creative Resources Technology Group, Inc.""},""content"":""""}","post","yes","TRUE","blog/category/general","","us/profile/505043","no"
"","0","7 Signs It’s Time to Replace Your Mac IT Provider","live","0","7 Signs It’s Time to Replace Your Mac IT Provider | Creative Resources Technology Group","For many business owners, ""good enough"" often feels like an acceptable standard when it comes to IT support. However, in today’s fast-paced, d...","December 19, 2024","https://www.creativeresources.net/2024/12/19/7-signs-its-time-to-replace-your-mac-it-provider/","{""title"":""7 Signs It’s Time to Replace Your Mac IT Provider"",""display-title"":""7 Signs It’s Time to Replace Your Mac IT Provider"",""article-author"":"""",""preview-image"":{""imagefile"":""https://tmtdemo.axionthemes.com/files/2024/12/January_Blog_4_image_.jpg"",""alt"":""7 Signs It’s Time to Replace Your Mac IT Provider""},""hero-image"":{""imagefile"":""https://tmtdemo.axionthemes.com/files/2024/12/January_Blog_4_image_.jpg"",""alt"":""7 Signs It’s Time to Replace Your Mac IT Provider""},""content"":""<p><img alt=\""7 Signs It’s Time to Replace Your Mac IT Provider\"" class=\""alignright size-full wp-image-13752\"" src=\""https://tmtdemo.axionthemes.com/files/2024/12/January_Blog_4_image_.jpg\"" width=\""300\"" height=\""300\"">For many business owners, \""good enough\"" often feels like an acceptable standard when it comes to IT support. However, in today’s fast-paced, digitally-driven world, even minor lapses in IT service can put your business at risk. If your IT provider isn’t meeting your needs, it could be causing more harm than good — and you might not even realize it until it’s too late.</p>\n<p>Here are seven key signs that it’s time to consider switching your IT provider.</p>\n<h3>1. You Can’t Reach Them During Emergencies</h3>\n<p>In the midst of a network crash or cybersecurity incident, every second counts. When you need help, waiting on hold or leaving a voicemail just isn’t acceptable. A reliable IT provider should be available to respond to emergencies quickly — ideally answering calls live or returning them within 30 minutes. If your provider is unresponsive when critical issues arise, it's a clear sign that they may not be equipped to support your business in times of need.</p>\n<h3>2. They Don’t Monitor Your Network Proactively</h3>\n<p>A great IT provider doesn’t wait for you to report problems — they anticipate and resolve issues before they disrupt your operations. Proactive network monitoring means they are constantly checking for potential vulnerabilities, system inefficiencies, or signs of a security breach. If you’re continually finding issues that your provider missed or neglected, it's time to rethink your partnership.</p>\n<h3>3. Cybersecurity Isn’t Their Priority</h3>\n<p>In today’s digital landscape, cybersecurity is more than just a buzzword — it’s the foundation of any solid IT infrastructure. If your provider hasn’t implemented a comprehensive cybersecurity strategy that includes protections against ransomware, regular vulnerability assessments, and reliable data backups, your business could be exposed to significant risks. A quality IT provider should be continuously updating your defenses against emerging threats. If your provider isn’t proactive about cybersecurity, it’s time to move on.</p>\n<h3>4. Their Support Is Inconsistent and Hard to Use</h3>\n<p>When you need IT support, you want a seamless, efficient experience — not long waits and frustrating ticket systems. A strong IT provider should have a clear, user-friendly ticketing system that tracks and prioritizes your requests. If your team is constantly facing delays, unresolved issues, or disjointed support processes, it's a clear sign that your IT provider is not prioritizing your business’s needs.</p>\n<h3>5. They Don’t Provide Clear, Transparent Invoices</h3>\n<p>You should always know exactly what you’re paying for — no hidden fees or confusing charges. If your provider’s invoices are vague, inconsistent, or if you’re being charged separately for every little task, it’s a red flag. Transparency and clarity in billing are hallmarks of a trustworthy IT partner. If you can’t easily understand where your money is going, it’s time to seek a provider who offers clear and upfront pricing.</p>\n<h3>6. They’re Not Testing Backups Regularly</h3>\n<p>Data loss can devastate your business, and your backup strategy is only as good as its reliability. If your IT provider isn’t regularly testing your backups — conducting routine test restores to ensure that your data can be recovered in the event of a disaster — you could be at serious risk. A dependable IT provider will have a robust, regularly-tested backup strategy in place, ensuring that your data is always recoverable.</p>\n<h3>7. Projects Are Always Late and Over Budget</h3>\n<p>Every IT project should come with clear timelines, budgets, and progress updates. If you’re constantly dealing with unexpected delays, hidden costs, or lack of communication from your IT provider, it’s a sign they may not be effectively managing your needs. A competent provider should deliver projects on time and within the agreed-upon budget — or, at the very least, keep you informed if things go off track.</p>\n<h3>Stop Settling for Subpar IT Support</h3>\n<p>Poor IT support can lead to unnecessary headaches, missed opportunities, and even serious business disruptions. If any of these warning signs sound familiar, it’s time to make a change and find an IT provider that can truly support your business’s needs.</p>\n<p>Start with a <strong>FREE Network Assessment</strong> from our team. We’ll evaluate your current setup, identify vulnerabilities, and provide actionable steps to strengthen your IT infrastructure.</p>\n<p><a href=\""https://www.creativeresources.net/discoverycall/\"">Click here</a><strong> to book your FREE Network Assessment now</strong> or call us at <strong>877-MACS-911</strong> to take the first step toward a better IT experience.</p>\n<p>Let us handle your IT, so you can focus on growing your business.</p>\n        <p id=\""post-admin\""></p>""}","post","yes","TRUE","blog/category/general","","2024/12/19/7-signs-its-time-to-replace-your-mac-it-provider/","no"
"","0","Inside Look: How Hackers Use AI to Attack Your Mac-Based Business","live","0","Inside Look: How Hackers Use AI to Attack Your Mac-Based Business | Creative Resources Technology Group","If you think hackers are only targeting large corporations, think again. Small and midsized businesses are now at the top of the cybercriminals' hi...","December 19, 2024","https://www.creativeresources.net/2024/12/19/inside-look-how-hackers-use-ai-to-attack-your-mac-based-business/","{""title"":""Inside Look: How Hackers Use AI to Attack Your Mac-Based Business"",""display-title"":""Inside Look: How Hackers Use AI to Attack Your Mac-Based Business"",""article-author"":"""",""preview-image"":{""imagefile"":""https://tmtdemo.axionthemes.com/files/2024/12/January_Blog_3_image_.jpg"",""alt"":""Inside Look: How Hackers Use AI to Attack Your Mac-Based Business""},""hero-image"":{""imagefile"":""https://tmtdemo.axionthemes.com/files/2024/12/January_Blog_3_image_.jpg"",""alt"":""Inside Look: How Hackers Use AI to Attack Your Mac-Based Business""},""content"":""<p><strong><img alt=\""Inside Look: How Hackers Use AI to Attack Your Mac-Based Business\"" class=\""alignright size-full wp-image-13748\"" src=\""https://tmtdemo.axionthemes.com/files/2024/12/January_Blog_3_image_.jpg\"" width=\""300\"" height=\""300\""></strong></p>\n<p>If you think hackers are only targeting large corporations, think again. Small and midsized businesses are now at the top of the cybercriminals' hit list — and AI is giving them the tools to launch attacks on a much larger scale.</p>\n<p>With AI, hackers can automate and refine their strategies, enabling them to outsmart businesses that aren’t properly prepared. And if your business relies on Macs, it doesn’t mean you’re immune. Hackers are targeting vulnerabilities in macOS and even exploiting the growing use of Apple devices in the workplace.</p>\n<p>Here’s a look at how AI is empowering cybercriminals to launch more sophisticated attacks, and how you can protect your Mac-based business from becoming a victim.</p>\n<h3>AI-Powered Phishing Scams: Smarter Than Ever</h3>\n<p>Traditional phishing attacks used to be easy to spot — poorly written emails with obvious red flags. But now, AI allows hackers to craft convincing, personalized messages that mimic real contacts or even trusted brands. They use AI to:</p>\n<ul>\n<li><strong>Scrape social media profiles</strong> to gather personal information about you and your employees.</li>\n<li><strong>Craft emails</strong> that sound completely authentic, mimicking the language and tone of people you know.</li>\n<li><strong>Mimic your business</strong>: Hackers can target employees with fake messages that look like internal communications.</li>\n</ul>\n<p><strong>Example</strong>: Imagine receiving an email that looks like it’s from your bank. It’s addressed to you by name, mentions your company, and references a “transaction attempt” that was declined. It asks you to “click here” to confirm your information or update your credit card details to avoid account suspension.</p>\n<p>If you click the link, it could:</p>\n<ul>\n<li><strong>Redirect you to a fake website</strong> that looks like your bank’s login page, capturing your credentials.</li>\n<li><strong>Install malware</strong> on your Mac, allowing hackers to spy on your keystrokes or even access your entire network.</li>\n</ul>\n<h3>Automated Vulnerability Scanning: Fast and Dangerous</h3>\n<p>AI is now used by cybercriminals to automate the process of scanning for vulnerabilities in small businesses. Tools powered by AI can:</p>\n<ul>\n<li><strong>Scan for outdated software</strong>, unpatched systems, or weak network configurations.</li>\n<li><strong>Target vulnerabilities</strong> within minutes, giving hackers a way into your network before you even realize there’s an issue.</li>\n</ul>\n<p>If you’re using older Macs or legacy applications that haven’t been updated, AI-powered tools can find and exploit these weaknesses quickly, potentially causing costly downtime and data theft.</p>\n<h3>AI-Driven Malware: Evolving in Real Time</h3>\n<p>Hackers are leveraging AI to create sophisticated malware that adapts quickly. These malicious programs can:</p>\n<ul>\n<li><strong>Evade detection</strong> by learning how antivirus software works, evolving in real time to avoid being flagged.</li>\n<li><strong>Adapt</strong> to exploit new vulnerabilities as they emerge.</li>\n</ul>\n<p>AI-powered ransomware is especially dangerous, locking down your systems and demanding ransoms in a more efficient, targeted manner. If your Mac systems aren’t protected with up-to-date security software, AI-driven malware could compromise your entire network.</p>\n<h3>Deepfake Technology: The New Face of Social Engineering</h3>\n<p>AI-generated deepfake videos and audio aren’t just used for entertainment—they’re now a tool for hackers. Cybercriminals use deepfakes to impersonate trusted individuals within your business, convincing employees to:</p>\n<ul>\n<li>Transfer funds.</li>\n<li>Share sensitive data.</li>\n</ul>\n<p><strong>Example</strong>: Imagine your CFO receives a phone call from someone who sounds exactly like your CEO. The \""CEO\"" urgently asks for a large wire transfer to close a deal, and the voice is so convincing that your CFO doesn’t hesitate to comply. Later, you discover the funds were sent to a fraudulent account.</p>\n<p>Deepfakes can make social engineering attacks much more believable, leaving even the most cautious employees vulnerable.</p>\n<h3>Advanced Password Cracking: AI Does It Faster</h3>\n<p>AI-powered algorithms can guess passwords at lightning speed. With techniques like pattern recognition, hackers can break even moderately strong passwords. Once inside your system, they can:</p>\n<ul>\n<li>Access sensitive data.</li>\n<li>Move laterally through your network to find even more valuable information.</li>\n</ul>\n<p><strong>Tip</strong>: Multifactor authentication (MFA) is no longer optional. It’s essential for combating the growing threat of AI-powered password cracking.</p>\n<h3>How to Protect Your Mac-Based Business from AI-Powered Cyberthreats</h3>\n<p>While AI is transforming cybersecurity for both attackers and defenders, there are steps you can take to safeguard your business. Here’s how to strengthen your defenses against AI-powered threats:</p>\n<h4>1. Invest in AI-Driven Defenses</h4>\n<p>Use cybersecurity tools that leverage AI to detect and respond to threats in real time. Some macOS-compatible solutions offer machine learning capabilities that can identify suspicious activity and block attacks before they escalate.</p>\n<h4>2. Educate Your Team</h4>\n<p>Train your employees on recognizing AI-powered phishing attempts and social engineering tactics. Even Mac users can fall prey to sophisticated scams, so everyone needs to know the red flags.</p>\n<h4>3. Conduct Regular Audits</h4>\n<p>Regularly assess your IT infrastructure for vulnerabilities, particularly on your Macs. Outdated software or weak configurations can leave you open to AI-powered attacks. Schedule regular updates and patching for macOS, browsers, and apps.</p>\n<h4>4. Strengthen Authentication</h4>\n<p>Implement multifactor authentication across your business, and encourage the use of strong, unique passwords for all accounts. Apple’s <strong>Keychain</strong> can help employees securely store and generate passwords for more robust protection.</p>\n<h4>5. Partner with Experts</h4>\n<p>Partner with a managed IT provider who can help you stay ahead of the curve. With proactive monitoring and security solutions, they can help safeguard your Macs from the latest AI-powered cyberthreats.</p>\n<h3>AI is a Game-Changer for Cybersecurity</h3>\n<p>As AI transforms how cybercriminals launch attacks, businesses must also use AI to bolster their defenses. By staying informed and proactive, you can help protect your business from the evolving threats of tomorrow.</p>\n<p><strong>Ready to fortify your business against AI-driven cyberattacks?</strong> <a href=\""https://www.creativeresources.net/discoverycall/\"">Click here</a> or call us at <strong>877-MACS-911 </strong>to schedule a <strong>FREE Cybersecurity Assessment</strong> today and ensure your defenses are AI-proof.</p>\n        <p id=\""post-admin\""></p>""}","post","yes","TRUE","blog/category/general","","2024/12/19/inside-look-how-hackers-use-ai-to-attack-your-mac-based-business/","no"
"","0","From Reactive to Proactive: Why Your IT Strategy Needs an Upgrade for Mac Users","live","0","From Reactive to Proactive: Why Your IT Strategy Needs an Upgrade for Mac Users | Creative Resources Technology Group","As we move through Q1 of 2025, one thing is abundantly clear: businesses that thrive are those that stay ahead of the quickly evolving technology landsc...","January 29, 2025","https://www.creativeresources.net/2025/01/29/from-reactive-to-proactive-why-your-it-strategy-needs-an-upgrade-for-mac-users/","{""title"":""From Reactive to Proactive: Why Your IT Strategy Needs an Upgrade for Mac Users"",""display-title"":""From Reactive to Proactive: Why Your IT Strategy Needs an Upgrade for Mac Users"",""article-author"":"""",""preview-image"":{""imagefile"":""https://tmtdemo.axionthemes.com/files/2025/01/February_Blog_4_Image-300x300.jpg"",""alt"":""From Reactive to Proactive: Why Your IT Strategy Needs an Upgrade for Mac Users""},""hero-image"":{""imagefile"":""https://tmtdemo.axionthemes.com/files/2025/01/February_Blog_4_Image-300x300.jpg"",""alt"":""From Reactive to Proactive: Why Your IT Strategy Needs an Upgrade for Mac Users""},""content"":""<p><img alt=\""From Reactive to Proactive: Why Your IT Strategy Needs an Upgrade for Mac Users\"" class=\""alignright size-medium wp-image-13815\"" src=\""https://tmtdemo.axionthemes.com/files/2025/01/February_Blog_4_Image-300x300.jpg\"" width=\""300\"" height=\""300\""></p>\n<p>As we move through Q1 of 2025, one thing is abundantly clear: businesses that thrive are those that stay ahead of the quickly evolving technology landscape. Reactive IT strategies—waiting for problems to occur before addressing them—are no longer sufficient. In a world where downtime, breaches, and inefficiencies can cost thousands of dollars in just minutes (yes, minutes!), it’s time to rethink your approach.</p>\n<p>If your business is still relying on a reactive IT strategy for your Mac systems, it’s time to make a change. Here’s why upgrading your strategy is crucial this year, and how shifting to a proactive approach can save your business time, money, and stress.</p>\n<h3>Why Reactive IT is Holding You Back</h3>\n<h4>1. <strong>Downtime Costs Too Much</strong></h4>\n<p>A single hour of downtime can cost businesses upwards of $10,000 or more, according to industry estimates. With a reactive IT approach, you’re waiting for something to break—whether that’s a system failure or a software glitch—before addressing it. This waiting game means lost productivity, frustrated employees, and the added costs of resolving the issue after it’s impacted your operations.</p>\n<p>Without a proactive plan, your Mac systems may experience prolonged downtime as the issue is diagnosed and resolved, further exacerbating revenue losses.</p>\n<h4>2. <strong>Security Threats Evolve Faster Than You Can Respond</strong></h4>\n<p>Cybercriminals are increasingly using advanced tools like AI to automate attacks, making them faster and harder to stop. If you’re using a reactive IT approach, you’re always playing catch-up, trying to recover after a breach or security incident has already occurred. This leaves your business vulnerable to sophisticated threats like ransomware, phishing, and other cyberattacks, especially as macOS systems become more targeted by hackers.</p>\n<h4>3. <strong>Productivity Suffers</strong></h4>\n<p>When employees battle slow systems, recurring tech issues, or outdated hardware, productivity takes a major hit. Employees will spend valuable time troubleshooting problems, and that’s time they’re not spending on their core responsibilities. These recurring issues can lead to frustration, lower morale, and even employee burnout, which can hurt your business long-term.</p>\n<h3>The Case for Proactive IT Management</h3>\n<p>A proactive IT strategy flips the script. Instead of waiting for problems to arise, proactive management anticipates issues, prevents downtime, and optimizes your Mac systems for maximum performance. Here’s how a proactive approach can benefit your business:</p>\n<h4>1. <strong>Early Detection Saves Time and Money</strong></h4>\n<p>Proactive monitoring tools designed for macOS environments can identify potential issues—such as failing hardware, security vulnerabilities, or inefficient workflows—before they disrupt your business. By addressing problems early, you can minimize costly downtime and avoid the operational impact of unexpected failures.</p>\n<p>For example, proactive monitoring can help detect hard drive issues or software vulnerabilities before they cause data loss or downtime, giving you a chance to repair or replace components before failure occurs.</p>\n<h4>2. <strong>Enhanced Cybersecurity</strong></h4>\n<p>Proactive IT providers who specialize in Mac environments implement advanced security measures designed to keep your business safe:</p>\n<ul>\n<li><strong>24/7 monitoring</strong> to detect unusual activity, potential breaches, and other threats.</li>\n<li><strong>Regular updates and patches</strong> to close security gaps and protect against the latest vulnerabilities in macOS and key apps.</li>\n<li><strong>Employee training</strong> to raise awareness and prevent phishing or social engineering attacks, which are becoming increasingly sophisticated.</li>\n</ul>\n<p>This layered, proactive approach keeps your data, devices, and networks safe from evolving threats, ensuring your business doesn’t fall behind on security.</p>\n<h4>3. <strong>Improved Productivity and Efficiency</strong></h4>\n<p>When your Mac systems are optimized and running smoothly, your employees can focus on what they do best. Proactive IT management ensures that your hardware, software, and network are working in sync for maximum performance. You’ll spend less time troubleshooting or managing disruptions, and more time driving results and innovation.</p>\n<p>For example, proactive updates for macOS ensure your systems stay secure and run efficiently, while regular checks and optimization can improve overall system speed, which boosts team productivity.</p>\n<h3>What Does Proactive IT Look Like for Mac Users?</h3>\n<p>A proactive IT provider will:</p>\n<ul>\n<li><strong>Monitor your network and systems 24/7</strong>, ensuring no security threats or performance issues go unnoticed.</li>\n<li><strong>Perform regular audits</strong> to keep your Mac hardware and software at optimal performance levels.</li>\n<li><strong>Keep your macOS and applications up to date</strong> with the latest updates and patches to ensure security and performance are always top-notch.</li>\n<li><strong>Offer strategic guidance</strong> to align your Mac systems with your business goals, helping you leverage technology for growth and innovation.</li>\n</ul>\n<p>Proactive IT management doesn’t just react to problems—it <strong>prevents</strong> them from happening in the first place.</p>\n<h3>Is Your IT Strategy Ready for 2025?</h3>\n<p>If your business is still relying on a reactive IT approach, you’re leaving yourself open to unnecessary risks and inefficiencies. Upgrading to a proactive IT strategy is not just a smart move—it’s a <strong>necessary</strong> one to keep your business competitive and secure in today’s fast-paced digital world.</p>\n<p><strong>Ready to make the shift?</strong> Schedule a <strong>FREE Network Assessment</strong> today. Our experts will evaluate your current IT setup, identify vulnerabilities, and provide a customized plan to ensure your business is ready for whatever 2025 throws your way.</p>\n<p><a href=\""https://www.creativeresources.net//discoverycall/\""><strong>Click here</strong></a>&nbsp;to book your <strong>FREE Network Assessment</strong> now!</p>\n<p>Don’t wait for the next tech disaster—get ahead of the game with proactive IT management and ensure your Mac systems are always running at their best.</p>\n        <p id=\""post-admin\""></p>""}","post","yes","TRUE","blog/category/general","","2025/01/29/from-reactive-to-proactive-why-your-it-strategy-needs-an-upgrade-for-mac-users/","no"
